{
  "schema_version": "1.0",
  "prompt_version": "1.1",
  "country": "fr",
  "insurer_slug": "maaf",
  "insurer_name": "MAAF — a single brand covering four regulated carriers: MAAF Assurances SA (société anonyme, Code des assurances, RCS Niort 542 073 580), MAAF Assurances (société d'assurance mutuelle à cotisations variables, Code des assurances, RCS Niort 781 423 280), MAAF Vie (société anonyme, Code des assurances, RCS Niort 337 804 819) and MAAF Santé (mutuelle du livre II du Code de la mutualité, SIREN 331 542 142). Group Covéa.",
  "product_name": "Assurance SANTÉ PROFIL SALARIÉS",
  "branch": "sante",
  "document_type": "conditions_generales",
  "language": "fr",
  "source_url": "https://www.maaf.fr/fr/files/live/sites/maaf/files/DOCUMENTS/Sante/CG/MAAF_Conditions_generales_Sante_MAAF_Pro_Salaries_11015.pdf",
  "source_pages": 34,
  "reference": "11015",
  "edition_date": "10.2025",
  "product_family": "Santé Profil Salariés",
  "target_audience": "entreprises",
  "coverages": [
    {
      "name": "Forfait journalier hospitalier",
      "limits": "Frais réels",
      "page": 6
    }
  ],
  "exclusions": [],
  "key_quotes": [
    {
      "quote": "Les Garanties du présent Contrat sont assurées par MAAF\nSanté, régie par le Code de la Mutualité, à l’exception des \ngaranties d’assistance santé à domicile qui sont assurées par \nMAAF Assurances SA.",
      "page": 5
    }
  ],
  "gaps": [
    "Extraction en cours - fichier partiel."
  ],
  "superseded": null,
  "source_pdf": "sante-profil-salaries-sante-collective-conditions-generales-ae034feb.pdf",
  "source_sha256": "6ea4f14fffb9b30709e7833bfdceda6461a1ce100a5aa633e8c6725313e51909",
  "fetched_at": "2026-08-01",
  "extraction_model": "claude-code-subagent:scale"
}
